{
  "schema_version": "checkpoint_record_v0",
  "checkpoint_id": "working",
  "run_id": "ALPHA_RUN_20260418T143428759596Z_e1524f",
  "task_class": "bounded_change",
  "event_type": "CREATE",
  "result": "OK",
  "checkpoint_root": "/root/alpha_external_run_014e/workspace/.synrail/checkpoints/working",
  "source_state": "INITIALIZED",
  "source_closure_status": "OPEN",
  "source_doctor_status": "UNKNOWN",
  "source_target_surface_status": "UNKNOWN",
  "source_integrity_status": "UNKNOWN",
  "source_resumability_status": "NOT_RESUMABLE",
  "source_resumability_family": "NOT_RESUMABLE_FRESH_ORCHESTRATION",
  "safe_point_class": "PRE_RUN_SNAPSHOT",
  "safe_point_eligible": true,
  "artifact_manifest": [
    {
      "artifact_id": "state",
      "path": "artifacts/state.json",
      "required": true,
      "kind": "STATE"
    }
  ],
  "verification": {
    "status": "NOT_RUN",
    "safe_point_eligible": false,
    "required_artifacts_present": false,
    "schema_validation_passed": false,
    "state_consistency_passed": false,
    "stale_artifacts_detected": [],
    "failure_reasons": []
  },
  "restore": {
    "status": "NOT_RUN",
    "target_root": "",
    "restore_verification_required": true,
    "restored_artifact_ids": [],
    "failure_reasons": []
  },
  "rollback": {
    "status": "NOT_NEEDED",
    "trigger": "NONE",
    "rolled_back_artifact_ids": [],
    "failure_reasons": []
  },
  "next_safe_step": "verify checkpoint before trusting restore",
  "workspace_snapshot": {
    "type": "file_copy",
    "project_root": "/root/alpha_external_run_014e/workspace",
    "snapshot_dir": "/root/alpha_external_run_014e/workspace/.synrail/checkpoints/working/workspace_files",
    "file_count": 8
  }
}
